{
  "version": "1.0",
  "requireBurnedSubtitles": true,
  "expectedDialogueIds": ["DIA-001", "DIA-002"],
  "background": "black",
  "output": {"path": "subtitled-9x16.mp4", "width": 720, "height": 1280, "fps": 24},
  "timeline": {
    "videoTracks": [{
      "id": "main",
      "clips": [{"source": "media/scene.mp4", "start": 0, "duration": 6}]
    }],
    "audioTracks": [{
      "id": "dialogue",
      "clips": [{"source": "media/dialogue.wav", "start": 0, "duration": 6}]
    }],
    "subtitleTracks": [{
      "id": "zh-CN",
      "style": {
        "font": "/System/Library/Fonts/STHeiti Medium.ttc",
        "size": 46,
        "color": "#FFFFFF",
        "outline": 3,
        "outlineColor": "#000000",
        "alignment": "bottom-center",
        "margins": {"left": 72, "right": 72, "top": 96, "bottom": 170},
        "wrap": 15
      },
      "clips": [
        {"id": "cap-001", "dialogue_id": "DIA-001", "text": "半夜送礼，不怕犯忌？", "start": 0.2, "duration": 2.5},
        {"id": "cap-002", "dialogue_id": "DIA-002", "text": "夫人的话，忌讳让路。", "start": 2.8, "duration": 2.7}
      ]
    }]
  }
}
